[
  {
    "id": "it_1a2b3c4d",
    "title": "1984",
    "kind": "book",
    "year": 1949,
    "borrowed": true,
    "author": "George Orwell"
  },
  {
    "id": "it_5e6f7a8b",
    "title": "Dune",
    "kind": "book",
    "year": 1965,
    "borrowed": false,
    "author": "Frank Herbert"
  },
  {
    "id": "it_9c0d1e2f",
    "title": "Blade Runner",
    "kind": "movie",
    "year": 1982,
    "borrowed": false,
    "director": "Ridley Scott"
  }
]